{"baselineId":"LGE-V1.4-2026-08-27","canonicalForm":{"arrayOrder":"DocumentOrder","duplicateMembers":"Reject","encoding":"AsciiEscaped","formId":"CanonicalJsonV1","memberOrder":"CodePointAscending","numbers":"IntegerOnly","separators":{"item":",","keyValue":":"},"unknownMembers":"Reject"},"digestAlgorithm":{"framing":"PrefixFreeOverCanonicalBytes","name":"SHA-256"},"digestDomains":[{"digest":"manifestDigest","domainTag":"CoreEngineManifestBody","input":"the CoreEngineManifestBody document itself (ADR-018; the one input with no digestDomain member)","normalization":[],"sortRule":"member order only; the body has no array whose order is semantic"},{"digest":"artifactSetDigest","domainTag":"ArtifactSetV1","input":"the ArtifactIndex with artifactSetDigest omitted, wrapped as {digestDomain,indexVersion,targetProfileId,entries}","normalization":[{"by":"path","collation":"codePoint","op":"sortAscending","path":"entries"}],"omitMembers":["artifactSetDigest"],"sortRule":"entries sorted ascending by path (code point); paths are unique within an index"},{"digest":"artifactIndexDigest","domainTag":"ArtifactIndexV1","input":"the complete ArtifactIndex document including artifactSetDigest, wrapped as {digestDomain,index}","normalization":[{"by":"path","collation":"codePoint","op":"sortAscending","path":"index.entries"}],"sortRule":"index.entries sorted ascending by path (code point)"},{"digest":"targetProfileDigest","domainTag":"TargetProfileV1","input":"the complete TargetProfile document, wrapped as {digestDomain,profile}","normalization":[],"sortRule":"member order only; the profile has no array"},{"digest":"capabilitySetDigest","domainTag":"CapabilitySetV1","input":"the capability id list, wrapped as {digestDomain,capabilities}","normalization":[{"by":"$self","collation":"codePoint","op":"sortAscending","path":"capabilities"}],"sortRule":"capabilities sorted ascending by code point; the array is uniqueItems so ties are impossible"}],"goldens":[{"canonicalBytes":"{\"digestDomain\":\"ArtifactSetV1\",\"entries\":[],\"indexVersion\":1,\"targetProfileId\":\"linux-server-x86_64-glibc\"}","case":"EmptyArtifactSet","id":"artifact-set-empty","input":{"digestDomain":"ArtifactSetV1","entries":[],"indexVersion":1,"targetProfileId":"linux-server-x86_64-glibc"},"sha256":"7a92ee35f0ae0644282f438a675d7624800a8aeac5125c85d7796d844831ce69"},{"canonicalBytes":"{\"digestDomain\":\"ArtifactSetV1\",\"entries\":[{\"kind\":\"License\",\"path\":\"evidence/license.spdx.json\",\"sha256\":\"1111111111111111111111111111111111111111111111111111111111111111\",\"size\":20480}],\"indexVersion\":1,\"targetProfileId\":\"linux-server-x86_64-glibc\"}","case":"SingleArtifact","id":"artifact-set-single","input":{"digestDomain":"ArtifactSetV1","entries":[{"kind":"License","path":"evidence/license.spdx.json","sha256":"1111111111111111111111111111111111111111111111111111111111111111","size":20480}],"indexVersion":1,"targetProfileId":"linux-server-x86_64-glibc"},"sha256":"b5102a58a8338bff3200949d01c341abaa66527628ea91cdaa7a928987e9a7e9"},{"canonicalBytes":"{\"digestDomain\":\"ArtifactSetV1\",\"entries\":[{\"kind\":\"License\",\"path\":\"evidence/license.spdx.json\",\"sha256\":\"1111111111111111111111111111111111111111111111111111111111111111\",\"size\":20480},{\"kind\":\"Provenance\",\"path\":\"evidence/provenance.json\",\"sha256\":\"2222222222222222222222222222222222222222222222222222222222222222\",\"size\":4096},{\"kind\":\"Sbom\",\"path\":\"evidence/sbom.cdx.json\",\"sha256\":\"3333333333333333333333333333333333333333333333333333333333333333\",\"size\":65536},{\"kind\":\"Header\",\"path\":\"include/lumio_core.h\",\"sha256\":\"4444444444444444444444444444444444444444444444444444444444444444\",\"size\":32768},{\"kind\":\"NativeLibrary\",\"path\":\"lib/liblumio_core.so\",\"sha256\":\"5555555555555555555555555555555555555555555555555555555555555555\",\"size\":10485760},{\"kind\":\"DebugSymbols\",\"path\":\"lib/liblumio_core.so.dwp\",\"sha256\":\"6666666666666666666666666666666666666666666666666666666666666666\",\"size\":5242880}],\"indexVersion\":1,\"targetProfileId\":\"linux-server-x86_64-glibc\"}","case":"MultiArtifact","id":"artifact-set-multi","input":{"digestDomain":"ArtifactSetV1","entries":[{"kind":"License","path":"evidence/license.spdx.json","sha256":"1111111111111111111111111111111111111111111111111111111111111111","size":20480},{"kind":"Provenance","path":"evidence/provenance.json","sha256":"2222222222222222222222222222222222222222222222222222222222222222","size":4096},{"kind":"Sbom","path":"evidence/sbom.cdx.json","sha256":"3333333333333333333333333333333333333333333333333333333333333333","size":65536},{"kind":"Header","path":"include/lumio_core.h","sha256":"4444444444444444444444444444444444444444444444444444444444444444","size":32768},{"kind":"NativeLibrary","path":"lib/liblumio_core.so","sha256":"5555555555555555555555555555555555555555555555555555555555555555","size":10485760},{"kind":"DebugSymbols","path":"lib/liblumio_core.so.dwp","sha256":"6666666666666666666666666666666666666666666666666666666666666666","size":5242880}],"indexVersion":1,"targetProfileId":"linux-server-x86_64-glibc"},"sha256":"7d851d441b751469da4c5e935736fe7684b18db9387d195a3dcbd48684d9a365"},{"canonicalBytes":"{\"digestDomain\":\"ArtifactSetV1\",\"entries\":[{\"kind\":\"License\",\"path\":\"evidence/license.spdx.json\",\"sha256\":\"1111111111111111111111111111111111111111111111111111111111111111\",\"size\":20480},{\"kind\":\"Provenance\",\"path\":\"evidence/provenance.json\",\"sha256\":\"2222222222222222222222222222222222222222222222222222222222222222\",\"size\":4096},{\"kind\":\"Sbom\",\"path\":\"evidence/sbom.cdx.json\",\"sha256\":\"3333333333333333333333333333333333333333333333333333333333333333\",\"size\":65536},{\"kind\":\"Header\",\"path\":\"include/lumio_core.h\",\"sha256\":\"4444444444444444444444444444444444444444444444444444444444444444\",\"size\":32768},{\"kind\":\"NativeLibrary\",\"path\":\"lib/liblumio_core.so\",\"sha256\":\"5555555555555555555555555555555555555555555555555555555555555555\",\"size\":10485760},{\"kind\":\"DebugSymbols\",\"path\":\"lib/liblumio_core.so.dwp\",\"sha256\":\"6666666666666666666666666666666666666666666666666666666666666666\",\"size\":5242880}],\"indexVersion\":1,\"targetProfileId\":\"linux-server-x86_64-glibc\"}","case":"PathOrderPermutation","id":"artifact-set-path-permutation","input":{"digestDomain":"ArtifactSetV1","entries":[{"kind":"DebugSymbols","path":"lib/liblumio_core.so.dwp","sha256":"6666666666666666666666666666666666666666666666666666666666666666","size":5242880},{"kind":"NativeLibrary","path":"lib/liblumio_core.so","sha256":"5555555555555555555555555555555555555555555555555555555555555555","size":10485760},{"kind":"Header","path":"include/lumio_core.h","sha256":"4444444444444444444444444444444444444444444444444444444444444444","size":32768},{"kind":"Sbom","path":"evidence/sbom.cdx.json","sha256":"3333333333333333333333333333333333333333333333333333333333333333","size":65536},{"kind":"Provenance","path":"evidence/provenance.json","sha256":"2222222222222222222222222222222222222222222222222222222222222222","size":4096},{"kind":"License","path":"evidence/license.spdx.json","sha256":"1111111111111111111111111111111111111111111111111111111111111111","size":20480}],"indexVersion":1,"targetProfileId":"linux-server-x86_64-glibc"},"sha256":"7d851d441b751469da4c5e935736fe7684b18db9387d195a3dcbd48684d9a365"},{"canonicalBytes":"{\"capabilities\":[\"Native\",\"ReferenceVoxel\",\"VoxelSnapshot\",\"VoxelStreaming\"],\"digestDomain\":\"CapabilitySetV1\"}","case":"CapabilityOrderPermutation","id":"capability-set-permutation","input":{"capabilities":["VoxelStreaming","Native","ReferenceVoxel","VoxelSnapshot"],"digestDomain":"CapabilitySetV1"},"sha256":"6c0859b0a2c6624a7725bcbdb2d71b1e2a65bbf413cac6874875dc69fc54d19a"},{"canonicalBytes":"{\"empty\":\"\",\"sample\":\"\\\"\\\\/\\b\\f\\n\\r\\t\\u001f\\u00e9\\u4e16\\ud834\\udd1e\"}","case":"EscapeBoundary","id":"escape-boundary","input":{"empty":"","sample":"\"\\/\b\f\n\r\t\u001f\u00e9\u4e16\ud834\udd1e"},"sha256":"b7fb9362f56ca50b68969d61dd73ee73f31a23a64d4f15a898045c1f6c4cb5eb"},{"canonicalBytes":"{\"sample\":[0,1,-1,9007199254740993,18446744073709551615,-9007199254740993]}","case":"IntegerBoundary","id":"integer-boundary","input":{"sample":[0,1,-1,9007199254740993,18446744073709551615,-9007199254740993]},"sha256":"a6135f19ccbcd596fb0bd7bc81fcd9770f49609c483812fc776bf71c28c2de73"},{"canonicalBytes":"{\"digestDomain\":\"ArtifactSetV1\",\"entries\":[{\"kind\":\"License\",\"path\":\"evidence/license.spdx.json\",\"sha256\":\"1111111111111111111111111111111111111111111111111111111111111111\",\"size\":20480}],\"indexVersion\":2,\"targetProfileId\":\"linux-server-x86_64-glibc\"}","case":"SchemaVersionChange","id":"artifact-set-schema-version","input":{"digestDomain":"ArtifactSetV1","entries":[{"kind":"License","path":"evidence/license.spdx.json","sha256":"1111111111111111111111111111111111111111111111111111111111111111","size":20480}],"indexVersion":2,"targetProfileId":"linux-server-x86_64-glibc"},"sha256":"e0fd1f58d4435bec2365841d68280a6bf03aa158e99de07c3e970f7bc836968e"}],"profileId":"canonical-digest-v1","schemaEpoch":1}
